,Song_Title,Artist,Lyricist,Composer,Lyric
0,I,"
Mr.Children",Kazutoshi Sakurai,Kazutoshi Sakurai,もう いいでしょう!? これで終わりにしよう ねぇ どうでしょう!? 君だってそう思うでしょ!? 散々 好き勝手生きてきて まだ何を欲しがってるんだい? 天国(ヘブン)かい? こんな風に日々は続いてくのでしょう 処方された薬にすがりつく「I」 「誰も悪くないの」とか言い出すんでしょ!? 自分を責めるふりして許しを請え Ah イメージは ドロップアウトした世界 さぁ どうでしょう!? 誰も見ないワンマンショー 泣いて傷ついたふりして 気を引いてみようかなぁ Ah そんな風に自分を甘やかすのでしょう 支持してくれるスポンサーに媚を売る「I」 挙句には「死にたい」とか言い出すんでしょう !? 思いどおりいかないときの一発芸 どう? 散々 周りを振り回して 結局 何をしたいんだか自分にもさっぱり分からないんだ こんな風に日々は続いてくのでしょう 奪いも捨てもせず 命を燃やそうか 自分が一番可愛い? ほら当たってるでしょう!? でもそれを責めたり 誰ができるの?
1,I Can Make It,"
Mr.Children",桜井和寿,桜井和寿,"明け方 非現実的な夢をバスタブに浮かべてみる 身体は疲れてるのに目は冴える やるべきことは沢山 「追いかけてるはずが追われてる」 ここんとこは そんな日々だ 「やれる」とは言ってみたけど確信はない いやむしろ自信は揺らいでる プレッシャーの前に引っ込めるアイデア 後悔だけを生んで 日の目を見ないままのこの願い ため息に溶け 飛んでいけ 全編を通し暗いタッチで描かれた モノクロの映画を観た 悲劇の主人公と自分重ねて 仲間が増えた気がした いつか自分さえ知らない自分に 驚きを感じたい 日の目を見ないままのこの誓い I Can Make It, I Can Make It 不可能を可能にするスキルを 泣く子も黙る自信と貫禄を 醜いアヒルが白鳥に変わる逆転劇起こせれば... 「ダメ」だと思った時なんて数知れず でもまだ早いさ 諦めたくない 何もやっていやしない 締め切りを前に取り下げるアイデア 後悔ばかりが増える 日の目を見ないままのこの願い ため息に溶け 飛んでいけ そしていつか自分の存在を証明して I Can Make It, Make It, Make It いつかは非現実的な夢も 叶うと信じ I Can Make It"
2,I'm sorry,"
Mr.Children",Kazutoshi Sakurai,Kazutoshi Sakurai,あれは血迷ってた僕の思い過ごしでした 八割位はあなたの言った通りでした いましがた 人づてで 御様子を知りました お詫びします 心から 大好きだったあの笑顔をもう一度 大嫌いなんて なじんないで今後とも 一区切りついたら 中華でもおごるから 雨降って地固まると そのことわざ通り 歩きましょう 肩並べて また駒沢通り いたしかたないなどと 開き直る気などない お詫びします 心から 人生だってあなたがいなくちゃ味気ない 今頃になって気付いた訳では決してない もしも望むのなら 土下座でもなんでもするから するから 笑って許して あれは血迷ってた僕の思い過ごしでした 九割近くはあなたの言った通りでした 大好きだったあの笑顔をもう一度 大嫌いなんて なじんないで今後とも 人生だってあなたがいなくちゃ味気ない 今頃になって気付いた訳では決してない もしも望むのなら 土下座でもなんでもするから するから 笑って許して I'm sorry.....
3,I'm talking about Lovin',"
Mr.Children",Kazutoshi Sakurai,Kazutoshi Sakurai,有効期限(リミット)までまだ間に合うぜ僕が手にしたone-way ticket 胸に秘めた不満も 不安も さて置いてRide! Ride! Ride! 何が起こるのか知らせないのが天使のエチケット 君にしたって本能に翻弄されるのも悪くないんじゃない!? Oh... I'm talking about Lovin' 君がいれば僕の周りの雑草も薔薇色の世界 吹雪きの日も暖房とレインコート 使わないで暖をとっていたい なんとかロスタイムまで持ち込んで1対1のPK 力まないで何度もファインゴール 振りぬいてど真ん中を狙え! Oh... I'm talking about Lovin' 君は運命の人って思ったりして 思い違いかなって迷ったりして 大きなシーソーの上で右往左往する Friendじゃ辛いけどThe ENDになるくらいなら 慌てなくていいや。。。 また明日 また明日 Oh... I'm talking about Lovin' 君は運命の人って思ったりして 間違いないよって念を押したりして 大きなスクランブルで立ち往生する もし縁遠くなったって未練たらしくしちゃいそうで なんだか怖いから。。。 また明日 また明日 有効期限までそう時間もないぜ僕の大事なone-way ticket 伝えたいのはONE WORD ONE WORD... Oh... I like you. I love you.
4,I'LL BE,"
Mr.Children",KAZUTOSHI SAKURAI,KAZUTOSHI SAKURAI,気が付きゃ勇み足 そんな日には深呼吸をしてみるんだ Tシャツの中を泳ぐ風と 共に歌いながら 乾きを癒せない砂漠の様に 何だって飲み込んでしまえる そんな漠然としたイメージだけが 今日も僕を支えてんだ 街がジオラマみたくみえるビルの最上階 形を変えながら飛ぶ雲が見えるかい? 今日はゾウ 明日はライオンてな具合に 心はいつだって捕らえようがなくて そんでもって自由だ 生きてる証を 時代に打ち付けろ 貧弱な魂で 悪あがきしながら 何度へましたっていいさ 起死回生で毎日がレボリューション 人生はフリースタイル 孤独でも忍耐 笑いたがる人にはキスを そしていつだって I say yes. I'll be there ピーナッツをひとつ 噛み砕きながら 飲み込んでしまった想いは 真夜中 血液に溶けて 身体中をノックした いつも心にしてたアイマスクを外してやればいい 不安や迷いと無二の親友になればいい 旅立とう 明日は無いぞってな具合に 胸に刻みながら一歩ずつ進んで いつだって夢中だ 腑甲斐無い自分に 銃口を突き付けろ 当たり障り無い 道を選ぶくらいなら 全部放り出して コンプレックスさえもいわばモチベーション 人生はいつもQ&Aだ 永遠に続いてく禅問答 そしていつの日か僕も dead I'll be back 駆け引きの世界で 僕が得たものを ダスタシュートに投げ込むよ 白地図を広げて 明日を待っていたい 目一杯の助走をつけて あのボーダーラインを飛ぶんだ 風向きを味方につけて 猫背を気にしながら 生きてる証を 時代に打ち付けろ 貧弱な魂で 悪あがきしながら 何度へましたっていいさ 起死回生で毎日がレボリューション 人生はフリースタイル 孤独でも忍耐 笑いたがる人にはキスを そしていつだって I say yes. I'll be there
5,I wanna be there,"
Mr.Children",桜井和寿,桜井和寿,不眠症になりそうな寝苦しい夜が ここ数日間続いて あるとき思い立った 似たような瞬間は これまでもあった でも今回はリアルだ 昨日の自分にさよならさ いちばんタフな靴を選んで また 装飾のない服を着て 音楽は俺の頭の中で鳴らしてく I wanna be there 「アホらしい」って もう一人の俺が言うぜ でも聞こえないんだ今は I wanna be there 「アンタらしいね」って 微笑んで さみしそうに見送ってくれないか 負けそうになった時の旅の道連れを 部屋中探して回った でも結局見つからなかった 必要なものを 足りないものを そうだ そのままに感じること 「生きていること」にもっと感謝して生きていたい I wanna be there 新しい出会いが待っている もしかしたら素敵な運命の人が(笑) I wanna be there 「アンタらしいね」って 手を振って 泣きながら見送ってくれないか I wanna be there 「アホらしい」って もう一人の俺が言うぜ でも聞こえないんだ今は I wanna be there 新しい出会いが待っている そうさきっとこの旅路の上で I wanna be there I wanna be there さみしそうに見送ってくれないか
6,蒼,"
Mr.Children",Kazutoshi Sakurai,Kazutoshi Sakurai,自分では精一杯してるつもり でも動かないものばかりで 揺らめく陽炎に憧れ 目で追う 触れないと知っていても その人なりが果たすべき使命に ただひたむきであれと諭すのに 静かに 静かに 夢はささくれ 届かぬ 祈りに 胸が暴れる ただただ自分の身の丈を知らされ わずかばかりの譲れぬ誇りに ただ正直であれと願うのに 静かに 密かに 嘘を重ね 淀んだ 時流れに 自由を奪われ ただただ自分の身の丈を知らされ それでも心は手を伸ばし続ける
7,秋がくれた切符,"
Mr.Children",KAZUTOSHI SAKURAI,KAZUTOSHI SAKURAI,風の匂いもいつしか 秋のものになってた カーディガン着た君の 背中見てそう思う 公園の緑は その葉落としはじめて カバンの中に一枚そっと着地した 神様が僕らにくれた 何かの切符みたいだ でも どこへ行けというんだろう この葉眺めて思う 茜色の夕日は 綺麗で切なくて このまま時間が止まればいいのにな 神様が僕らにくれた 何かの切符みたいだ でも なんの褒美なんだろう 今日も喧嘩したのに 神様が僕らにくれた 何かの切符みたいだ 君はまだ気付いてないんだな その贈り物に 風の匂いもいつしか 秋のものになってた 寒そうにしてる君に 駆け寄り手を繋ぐ
8,others,"
Mr.Children",桜井和寿,桜井和寿,君の指に触れ くちびるに触れ 時間(とき)が止まった 硬い氷は溶け 身体中を滑る 2人の熱で 何が起こったの？ しばらく何も考えたくない 窓の外の月を見てる まるで近未来の映画のよう アンドロイドが 感情なんかなく ただ互いのエネルギーを 吸い合うように 意味はあるだろう… たけど深く考えられない 気まずさでビール口に運んだ テーブルの上の灰皿 アメリカ史紐解く文庫本 それはきっと彼のもの 「そろそろ行くね」って僕の 言葉を待っていたかのよう 無駄のない動きで君は そう僕に手を振る 「すぐ捕まるさ」 そう言いながらスニーカーを履き タクシーに向けて僕は走った ベッドで聞いていた blues 誰の曲かも君は知りはしない きっと彼の好きな曲 愛し愛されてたとしても そう感じられるのは一瞬で その一瞬を君は僕に分けてくれた 君の胸に触れ くちびるに触れ 時間が止まった 硬い氷は溶け 身体中を滑る 2人の熱で 何が起こったの？ このまま何も考えたくない 25時の首都高に輝く 窓の外の月を見てる
9,足音 ～Be Strong,"
Mr.Children",桜井和寿,桜井和寿,新しい靴を履いた日は それだけで世界が違って見えた 昨日までと違った自分の足音が どこか嬉しくて あてもなく隣の町まで 何も考えずしばらく歩いて 「こんなことも最近はしてなかったな...」って ぼんやり思った 舗装された道を選んで歩いていくだけ そんな日々 だけど もうやめたいんだ 今日はそんな気がしてる 夢見てた未来は それほど離れちゃいない また一歩 次の一歩 足音を踏み鳴らせ！ 時には灯りのない 寂しい夜が来たって この足音を聞いてる 誰かがきっといる 疲れて歩けないんなら 立ち止まってしがみついていれば 地球は回っていって きっといい方向へ 僕らを運んでくれる どんな人にだって心折れそうな日はある 「もうダメだ」って思えてきても大丈夫 もっと強くなっていける 今という時代は 言うほど悪くはない また一歩 次の一歩 靴紐を結び直して 喜びを分かち合い 弱さを補い合い 大切な誰かと歩いていけるなら もう怖がんないで 怯(ひる)まないで 失敗なんかしたっていい 拒まないで 歪めないで 巻き起こってる すべてのことを真っ直ぐに受け止めたい 夢見てた未来は それほど離れちゃいない また一歩 次の一歩 足音を踏み鳴らせ！ 例えば雨雲が 目の前を覆ったって また日差しを探して歩き出そう 時には灯りのない 孤独な夜が来たって この足音を聞いてる 誰かがきっといる
10,addiction,"
Mr.Children",KAZUTOSHI SAKURAI,KAZUTOSHI SAKURAI,週末を跨いだ長い連休を前に 街は少し浮き足だって 行楽地を目指して渋滞が始まった 排気ガスを撒き散らして window に映り込んだ男は今 無表情を決め込んで自分を圧し殺してる どんなに言い聞かせても 変われぬものがあるよ 欲しくてたまらないよ more more more！ ほら 誰かが今日も それを持て余してるよ 上級者は誰にも感づかれぬように 上手いことやってるらしい あちら側の自分と ここで生きる自分を 冷静にコントロールして そろそろwoofer に身悶えて その衝動が今君の理性をぶち壊してく 今日は我慢出来ても また手を出してしまうだろう 時々恐くなるよ more more more！ さぁ 内なる声に ほら 耳を澄ましてごらん 今日は我慢出来ても また手を出してしまうだろう 決して満足なんか出来ないよ more more more！ 首を横に振ってみても きっと拒めはしないだろう 欲しくて堪らないよ more more more！ どんなに言い聞かせても 今日は大人しく出来ても またすぐ欲しくなるよ more more more！
11,Another Story,"
Mr.Children",Kazutoshi Sakurai,Kazutoshi Sakurai,最終のバスにはまだ間に合うかなぁ 遠くの街まで君を迎えに行く いつも笑ってた 無理してたんだな それも分かってた 自分のことばかりいつも主張して 君の言葉なら上の空で聞いて ギターを弾いてた ぼんやりといつも ギターを弾いてた ごめんねって言葉 君は聞き飽きてるんじゃないかなぁ? どんな風に言えば 優しい君は戻ってくるかなぁ? よく出かけた公園をバスは今通過中 いつかの君が横切る 記念日を携帯が知らせてくれて そんなときばかりうまく立ち回って 誇張して言えば そんな感じだろう 君にしてみれば 抱き合いながら 僕らは孤独とキスをして 分かったような台詞 ささやきながら眠りに落ちて 朝が来て日常が 僕らを叩き起こし 逃げるようにベットから這い出る 最終のバスは君にたどり着いて 恐る恐る僕は君の名を呼んだ 君は笑ってた 無理はしないでよ だけど笑ってた 夢とか理想とかおもちゃみたいにまだ思ってるかなぁ? 分かり合うなんてそう簡単じゃないのは分かってる ごめんねって言葉 君は聞き飽きてるんだろうけど 誤解がしょうじないように 簡潔に伝えられぬもんかなぁ 君と生きる毎日が なんだかんだ言って嬉しい そう君の笑顔と共に そう君の笑顔と共に
12,Another Mind,"
Mr.Children",桜井和寿,桜井和寿,何故に卑屈な微笑浮ぶ この街角 行き交う人の波が 奏でてる不協和音(discord) 自分を打ち砕くリアルなものは 偽りだと目を伏せてた 個独な Teenage 幼き日々のように 無邪気なふりをしては 愛すべき人達(ひと)の 支えの中に溺れてゆく 傷つけずにいられない程 誰かが定めた自分を演じてる Another Mind 流されるのも慣らされて たどり着けばいつも Oh No 何もかも投げ出せば It's just darkside of my heart 肩の荷もおりそうさ It's just darkside of my heart わずかなプライドを守る為に 誰もが必死で暮してる 砂に書いたような“理想”の文字は 時代(とき)の波にさらわれてく 不思議なこの街 誰も愛さずにいれるものなら 罪な恋に惹かれてゆく この心を消してくれ 誰かが定めた自分を演じてる Another Mind 身動きもできない程に 抱えたプレッシャーはシュール 流されるのも慣らされて たどり着けばいつも Oh No 振り向けば夕闇が包む この街角
13,雨のち晴れ,"
Mr.Children",桜井和寿,桜井和寿・小林武史,単調な生活を繰り返すだけ そんな毎日もいいさ 親友との約束もキャンセルして 部屋でナイターを見よう あの娘が出て行ったのは もう3ヵ月前 淡い想い出だけを ほのかに残して 涙もない 言葉もでない あっけない結末 あれほど燃え上がってた二人が嘘みたい 最近じゃ グラマーな娘に滅法弱い 男ってこんなもんさ 新人のマリちゃんに言い寄っても まるで手応えが無い 不景気のあおり受けて 社内のムードは 緊迫しているから 僕一人が浮いてる 上司に愚痴言われるうちが「花」だって言うから いっそ可憐に咲き誇ろうかと思うよ もうちょっと もうちょっと 頑張ってみるから ねえもっと ねえもっと いい事があるかな 今日は雨降りでも いつの日にか 「お前って暗い奴」そう言われてる 幼少の頃からさ 1DK狛江のアパートには 2羽のインコを飼う たまに実家に帰れば 真面目な顔して 出来損ないの僕に母親は繰り返す 「生きているうち孫を抱きたい」それもわかる気がする なるべくいい娘探したいって思っちゃいるけど もうちょっと もうちょっと 僕を信じてみて こうなっちゃ こうなっちゃ 後戻りできない イメージはいつでも 雨のち晴れ 優秀な人材と勘違いされ あの日の僕はただ 過酷なしがらみを 掻き分けては 頭を下げていた 若さで乗り切れるのも 今年ぐらいだね この先どうなるのかなんて 誰もわからない その日暮し 楽しく生きりゃいいのかもしれないね そんな事思いながらも また日が暮れる もういいや もういいや 疲れ果てちまった そう言って そう言って ここまで来たじゃないか 今日は雨降りでも いつの日にか もうちょっと もうちょっと 頑張ってみるから ねえもっと ねえもっと いい事があるかな イメージはいつでも 雨のち晴れ いつの日にか 虹を渡ろう
14,ALIVE,"
Mr.Children",KAZUTOSHI SAKURAI,KAZUTOSHI SAKURAI,この感情は何だろう 無性に腹立つんだよ 自分を押し殺したはずなのに 馬鹿げた仕事を終え 環状線で家路を辿る車の中で 全部おりたい 寝転んでたい そうぼやきながら 今日が行き過ぎる 手を汚さず奪うんだよ 傷つけずに殴んだよ それがうまく生きる秘訣で 人類は醜くても 人生は儚くても 愛し合える時を待つのかい 無駄なんじゃない 大人気ない 知っちゃいながら さぁ 行こう 夢はなくとも 希望はなくとも 目の前の遥かな道を やがて何処かで 光は射すだろう その日まで魂は燃え 誓いは破るもの 法とは犯すもの それすらひとつの真実で 迷いや悩みなど 一生消えぬものと思えたなら ボクらはスーパーマン 怖いものなんてない 胸を張ってたい そして君と さぁ 行こう 意味はなくとも 歩は遅くとも 残されたわずかな時を やがて荒野に 花は咲くだろう あらゆる国境線を越えて さぁ 行こう 報いはなくとも 救いはなくとも 荒れ果てた険しい道を いつかポッカリ 答えが出るかも その日まで魂は燃え 夢はなくとも 希望はなくとも 目の前の遥かな道を やがて荒野に 花は咲くだろう あらゆる国境線を越え
15,ありふれた Love Story ～男女問題はいつも面倒だ～,"
Mr.Children",KAZUTOSHI SAKURAI,KAZUTOSHI SAKURAI,変わらぬ愛と信じきっていた二人 移りゆく季節を歩いてきた 若気の到りなんて他人は云う ありふれた者同志の Love Story 彼は重い鞄を引きずって 街中を駆け回ってるビジネスマン 追われるように過ぎ去っていく暮らし 夢見たもんと遠く離れていた 苛立っていた 戸惑っていた 映画にある様な出会いなど滅多にはないから 知人の伝手なんか頼っては恋を探してた 彼女は生まれた町から都会へ出たばかり 猜疑心と好奇心両手に抱え 悪戦苦闘くり返してる毎日で…… そして恋は生まれた 運命の糸が操っている様にも思えた 愛は尽きる事ない 想いは揺るがない そう信じてた やがて二人は暮らし始めた 若さのわりに優雅なマンションで 互いのプライバシーを尊重して 上手くバランス取ってるはずだった でも人生とはいつも困難で いつしか二人嫌なムード 啀み合うばかり 冷めてく想いを分かってるくせに 気付かぬ振りでやり過ごしている 大人を気取れど 自我を捨てれない 辻褄合わせるように抱き合って眠る 「愛は消えたりしない 愛に勝るもんはない」なんて流行歌の戦略か? そんじゃ何信じりゃいい? 「明日へ向かえ」なんていい気なもんだ 混乱した愛情故に友情に戻れない 男女問題はいつも面倒だ そして恋は途切れた 一切合切飲み込んで未来へと進め
16,アンダーシャツ,"
Mr.Children",KAZUTOSHI SAKURAI,KAZUTOSHI SAKURAI,練りに練られたカリキュラムにそって  若年寄はトレンド志向の強い Dream あなたも私も何かが足りない 心の隙間を金で満たし Cheers デザイナーズブランド インポートワイン “高価い物がいいもん”の理論 叩き込まれて 僕等は不敵 何処かの国では宗教がらみの正義をめぐって しかけるプラスティックボム ご飯は残して外国から仕入れて 平和でいいな戦争の無い国 フリースタイル ジャズ モータウンサウンド ウエストコースト カントリーにテクノ ジャンルは ともかく 音を鳴らせ 泣いて 笑って 叫んで 溢れ出すエゴ 抱いて 触って 歌って 魂よ癒えよ 心はいつでも 真っ白なアンダーシャツ 金縛りにあい涙をためても 隣の女の態度は他人行儀 テレビをつければバブルがはじけて 私腹を肥やして捕まる参議院議員 スリーオンスリー ロッククライミング フットサル フリスビーにゴルフ なりふりかまわず 汗を流せ 飛んで 走って 転んで 体脂肪よ燃えよ 吸って 吐いて 吐いて 魂よ癒えよ 朝から晩まで 真っ白なアンダーシャツ 何から何まで意味なく思えて 紳士な振りして静かに飲む GIN いつかは誰もがやがては誰もが 死にゆく自分を愛せるだろう 泣いて 笑って 叫んで きりがないエゴ 抱いて 触って 歌って 魂よ癒えよ 食って 飲んで 眠って 起きて 生まれて 生きて 死んで 魂よ癒えよ 心はいつでも 真っ白なアンダーシャツ 冬でも夏でも 真っ白なアンダーシャツ
17,and I close to you,"
Mr.Children",桜井和寿,桜井和寿・小林武史,Baby Baby Baby I wanna kiss you Lady Lady Lady and I wait for you 思ってたような奴じゃなかったようだね まだ君を傷つけるつもりなら許さない Baby Baby Baby もう忘れなよ 悲しみの中では何にも生まれない 同じ事を繰り返してるのなら 何もかも委ねてよ この僕に 気付かぬふりが上手(うま)いから あいつの裏切りも 僕の想いも 揉み消すつもりなの？ 何にも言えずに別れた夏を 悔やんでても虚しい Baby Baby Baby I wanna kiss you Lady Lady Lady and I close to you 泣き疲れて眠っている君に くちづけたあの夜が愛しくて 目を腫らす君を見る度 この胸がちぎれそうだよ 何故そんなに あいつじゃなきゃダメなの？ もう一度抱きしめたなら離せなくなる程に I love you You must be break down 電話のベルが It's just a mad love 鳴る度 心のどこかで I want to be your man かすれた君のその声が クールなふりした僕を狂わせる Baby Baby Baby もう忘れなよ 悲しみの中では何にも生まれない Baby Baby Baby Iwanna kiss you Lady Lady Lady and I close to you
