,Song_Title,Artist,Lyricist,Composer,Lyric
56,君と重ねたモノローグ,"
Mr.Children",桜井和寿,桜井和寿,また会おう この道のどこかで ありがとう この気持ち届くかな 果てしなく続くこの時間の中で ほんの一瞬 たった一瞬 すれ違っただけだとしても 誰かにとっての完璧(パーフェクト)は 誰かにとっての不完全 違う場所から覗いた景色は こんなにも こんなにも 素敵なもので満ちてる 僕を閉じ込めていたのは 他でもない僕自身だ その悔しさと その希望に気付かせてくれたのは君 僕に翼は無いけれど 今なら自由に飛べるよ 心の中 その大空を 君とどこまでも飛んで行こう いつしか僕も歳を取り 手足が動かなくなっても 心はそっと君を抱きしめてる いつまでも いつまでも 君の頭撫でながら 鏡に映った自分の 嫌なとこばかりが見えるよ 恵まれてる 違う誰かと 比べてはいつも 諦めることだけが上手くなって それでも前を向けたのは 君と重ねたモノローグが 孤独な夜を切り裂きながら この心強くするから 僕に翼は無いけれど 君となら高く飛べるよ 光が射す その大空を 風の詩を聴きながら飛んで行こう また会おう この道のどこかで ありがとう この気持ち届くかな 果てしなく続くこの時間の中で ほんの一瞬 たった一瞬 すれ違っただけだとしても 君は僕の永遠
57,君の事以外は何も考えられない,"
Mr.Children",桜井和寿,桜井和寿,真夜中過ぎても眠れないから 今夜はこのまま星を見つめて 君から聞いた お伽話 少し信じてみようかな 君の事以外は何も考えられない いつもそばにいてよ いつまでもそばにいるよ いくつになっても風に吹かれて いったいこの先どうなるのだろう 僕が途方に暮れてる時 君の言葉で救われる 君の事以外は何も考えられない いつもそばにいてよ いつまでもそばにいるよ こうして二人でいられる時は 不思議だね一日がすぐに過ぎてく 君が居眠りする間に 新しい歌が 生まれる 君の事以外は何も考えられない いつもそばにいてよ いつまでもそばにいるよ 君の事以外は何も考えられない いつもそばにいてよ いつまでもそばにいるよ
58,CANDY,"
Mr.Children",Kazutoshi Sakurai,Kazutoshi Sakurai,「あきらめよ」と諭す回路に 君がそっと侵入してきて 何食わぬ顔で 夢をチラつかす 上手に包んで仕舞ったものが「飛び出したい」と疼いてる 痛い記憶を最後に寝たふりしていたくせに 柄でもないけど 会えると嬉しいよ 悩んだ末に想いを飲み込む日々 ほろ苦いキャンディーが まだ胸のポケットにあった 気付かせたのは君 多くの事を求め過ぎて 出来るだけ側に居たくて そんなことをしてる間に息が詰まる 大抵 人はこんな感じで大事なもんを失うんだろう そして凝りもせず 君を欲しがってる みっともないけど すべてが愛しいよ ふと夕暮れに孤独が爆発する 甘酸っぱいキャンディーが 僕の胸のポケットにあるんだ 君が食べておくれ 昨日の夜 いつもの偏頭痛が僕を襲って 飲み込むタブレット やけに会いたくて 声が聞きたくなって みっともないけど すべてが愛しいよ ひとり夜更けに孤独が爆発する ほろ苦いキャンディーが まだ胸のポケットにあった ただ ひとつだけ 甘酸っぱいキャンディーが まだ胸のポケットにあるんだ 君が食べておくれ
59,擬態,"
Mr.Children",Kazutoshi Sakurai,Kazutoshi Sakurai,ビハインドから始まった 今日も同じスコアに終わった ディスカウントして山のように 積まれてく夢の遺灰だ あたかもすぐ打ち解けそうに親しげな笑顔を見せて 幽霊船の彼方に明日が霞んでく アスファルトを飛び跳ねる トビウオに擬態して 血を流し それでも遠く伸びて 必然を 偶然を すべて自分のもんにできたなら 現在を越えて行けるのに。。。 相棒は真逆のセンスと真逆の趣味を持って アリキタリなことを嫌った なんかそれがうらやましかった ムキになって洗った手に こびりついてる真っ赤な血 いつか殺めた自分にうなされ目覚める “効きます”と謳われたあらゆるサプリメントは 胃の中で泡(あぶく)になって消えた デマカセを 真実を すべて自分のもんにできたなら もっと綺麗でいれるのに。。。 富を得た者はそうでない者より 満たされてるって思ってるの!? 障害を持つ者はそうでない者より 不自由だって誰が決めんの!? 目じゃないとこ 耳じゃないどこかを使って見聞きをしなければ 見落としてしまう 何かに擬態したものばかり 今にも手を差し出しそうに優しげな笑顔を見せて 水平線の彼方に希望は浮かんでる アスファルトを飛び跳ねる トビウオに擬態して 血を流し それでも遠く伸びて 出鱈目を 誠実を すべて自分のもんにできたなら もっと強くなれるのに。。。 現在を越えて行けるのに。。。
60,GIFT,"
Mr.Children",Kazutoshi Sakurai,Kazutoshi Sakurai,一番きれいな色ってなんだろう? 一番ひかってるものってなんだろう? 僕は探していた 最高のGIFTを 君が喜んだ姿をイメージしながら 『本当の自分』を見つけたいって言うけど 『生まれた意味』を知りたいって言うけど 僕の両手がそれを渡す時 ふと謎が解けるといいな 受け取ってくれるかな 長い間 君に渡したくて 強く握り締めていたから もうグジャグジャになって 色は変わり果て お世辞にもきれいとは言えないけど 「白か黒で答えろ」という 難題を突きつけられ ぶち当たった壁の前で 僕らはまた迷っている 迷ってるけど 白と黒のその間に 無限の色が広がってる 君に似合う色探して やさしい名前をつけたなら ほら 一番きれいな色 今 君に贈るよ 地平線の先に辿り着いても 新しい地平線が広がるだけ 「もうやめにしようか?」 自分の胸に聞くと 「まだ歩き続けたい」と返事が聞こえたよ 知らぬ間に増えていった荷物も まだなんとか背負っていけるから 君の分まで持つよ だからそばにいてよ それだけで心は軽くなる 果てしない旅路の果てに 『選ばれる者』とは誰? たとえ僕じゃなくたって それでもまた走っていく 走っていくよ 降り注ぐ日差しがあって だからこそ日陰もあって そのすべてが意味を持って 互いを讃えているのなら もうどんな場所にいても 光を感じれるよ 今 君に贈るよ 気に入るかなぁ? 受け取ってよ 君とだから探せたよ 僕の方こそありがとう 一番きれいな色ってなんだろう? 一番ひかってるものってなんだろう? 僕は抱きしめる 君がくれたGIFTを いつまでも胸の奥で ほら ひかってるんだよ ひかり続けんだよ
61,口がすべって,"
Mr.Children",Kazutoshi Sakurai,Kazutoshi Sakurai,口がすべって君を怒らせた でも間違ってないから謝りたくなかった 分かってる それが悪いとこ それが僕の悪いとこ 「ゆずれぬものが僕にもある」だなんて だれも奪いに来ないのに鍵かけて守ってる 分かってる 本当は弱いことを それを認められないことも 思い通りに動かない君という物体を なだめすかして 甘い言葉かけて 持ち上げていく もう一人の僕がその姿を見て嘆いてるんだよ 育んできたのは「優しさ」だけじゃないから。。。 争い続ける 血が流れている 民族をめぐる紛争を 新聞は報じてる 分かってる 「難しいですね」で 片付くほど簡単じゃないことも 誰もがみんな大事なものを抱きしめてる 人それぞれの価値観 幸せ 生き方がある 「他人の気持ちになって考えろ」と言われてはきたけど 想像を超えて 心は理解しがたいもの 流れ星が消える 瞬く間に消える 今度同じチャンスがきたら 自分以外の誰かのために 願い事をしよう 口がすべって君を怒らせた でもいつの間にやら また笑って暮らしてる 分かったろう 僕らは許し合う力も持って産まれてるよ ひとまず そういうことにしておこう それが人間の良いとこ
62,口笛,"
Mr.Children",桜井和寿,桜井和寿,頼り無く二つ並んだ不揃いの影が 北風に揺れながら延びてゆく 凸凹のまま膨らんだ君への想いは この胸のほころびから顔を出した 口笛を遠く 永遠に祈る様に遠く 響かせるよ 言葉より確かなものに ほら 届きそうな気がしてんだ さあ 手を繋いで 僕らの現在が途切れない様に その香り その身体 その全てで僕は生き返る 夢を摘むんで帰る畦道 立ち止まったまま そしてどんな場面も二人なら笑えますように 無造作にさげた鞄にタネが詰まっていて 手品の様 ひねた僕を笑わせるよ 形あるものは次第に姿を消すけれど 君がくれた この温もりは消せないさ いつもは素通りしてたベンチに座り 見渡せば よどんだ街の景色さえ ごらん 愛しさに満ちてる ああ 雨上がりの遠くの空に虹が架かったなら 戸惑いや 不安など 簡単に吹き飛ばせそうなのに 乾いた風に口笛は 澄み渡ってゆく まるで世界中を優しく包み込むように 子供の頃に 夢中で探してたものが ほら 今 目の前で手を広げている 恐がらないで踏み出しておいで さあ 手を繋いで 僕らの現在が途切れない様に その香り その身体 その全てで僕は生き返る 夢を摘むんで帰る畦道 立ち止まったまま そしてどんな場面も二人で笑いながら 優しく響くあの口笛のように
63,靴ひも,"
Mr.Children",Kazutoshi Sakurai,Kazutoshi Sakurai,いつまでうだうだしてるんだ どうすべきかは知ってるんだ 君の絵の具で濁った僕がいい こだわってたものみんな 誰かに譲ったっていいや 失いたくない 急がなくちゃ 靴ひもも結ばずに 駆け足で飛び出して 停留所を通過してく そのバスに飛び乗って あぁ 一秒でも早く君の待つ場所へ スーパーの前の歩道に 主人を待つ雑種の犬 ガードレールに繋がれている 君に微笑んで欲しくて 吊り革握っている僕とどこか似ている そわそわして 愛しくて 苦しくて そして自分を見失って ウザッたくて 終わらして でももっと 苦しくて あぁ 一瞬でも早く君の待つ場所へ 渋滞で 停車した このバスを飛び出して 靴ひもも気にせずに 全力で駆け出して 愛しくて 切なくて 君の色で 濁っている その部分が 今一番 好きな色 僕の色 あぁ 一秒でも早く君の待つ場所へ あぁ 一瞬でも早く君の待つ場所へ
64,蜘蛛の糸,"
Mr.Children",桜井和寿,桜井和寿,心は今 あらゆる可能性を網羅して 君へと向かう か細い糸を選んだ それは蜘蛛の巣 或いは罠に誘う澄んだ糸 体中に纏い死んだとしても本望 荒れ茂る木々の暗がりで 夜露の滴(しずく)に濡れて煌めく その美しき糸を 指で触れるよ この想いを闇雲に振りほどこうとして でも出来なくて余計にきつく絡まるだけ 恋の終わりの虚しさを 君だって知っているだろうさ それなのに物怖じしない強さに惹かれてくよ 退屈な日々の暗がりで 月光に照らされ揺れる 踊るように その怪しい光に 目がくらむよ 君という無二の糸を 引き寄せるよ
65,クラスメイト,"
Mr.Children",桜井和寿,桜井和寿,多忙な仕事あってこそ優雅な生活(くらし) なのにやりきれぬ oh sunday morning 愛を語らい合って過ごしたいけれど 悩める事情にさいなまれ 陽は傾き街は3時 少し遅い君とのランチ 後ろめたさで 微かに笑顔が沈んじゃうのは 仕方がないけれど 3ヵ月前の再会から 思ってもない様な急展開 今じゃ もっと彼女に恋をして もう 振り出しに戻れるわけない 「ただのクラスメート」 そう 呼び合えたあの頃は a long time ago 何度も話し合って決めたルールでも このままじゃ彼女 かわいそうさ もう時期来る君のBirthday 迷わず僕だけを選んで ごめんよ いつも困らすばかりで しばらくは彼の話はやめとこう 君といれば他のどんなものも ささいな事に思えてくる 今までのキャリアもわかるけど ねぇ 何もかも委ねてくれないか 寂しげな街の灯が消えぬ間に I wanna hold you again 明け方の歩道「じゃね またね」と彼女 走り去るTAXI マンションのベランダに立って手を振る僕 たまらなく寂しい そして 今日も街は動き出す 行き交う人並み from sunday night to monday morning
66,車の中でかくれてキスをしよう,"
Mr.Children",桜井和寿,桜井和寿,もう二人は 子供じゃない だけど いたずらに ただ 傷ついてくだけ 抱きしめても すり抜けてゆく君の その心を 閉じ込めていたい 車の中でかくれてキスをしよう 誰にも 見つからないように 君は泣いてるの？ それとも笑ってるの？ 細い肩が震えてる 誰もいない 月の浮かぶプールに 忍びこんで 波をたてる君 震えている 青ざめた唇を 僕に見せて 笑いころげてる 車の中で かくれてキスをしよう 誰にも 見つからないように 疲れ果てたまま 眠りについた君を いつまでも 見守ってる 車の中でかくれてキスをしよう 誰にも 見つからないように 君は泣いてるの？ それとも笑ってるの？ 細い肩が震えてる
67,くるみ,"
Mr.Children",Kazutoshi Sakurai,Kazutoshi Sakurai,ねぇ くるみ この街の景色は君の目にどう映るの? 今の僕はどう見えるの? ねぇ くるみ 誰かの優しさも皮肉に聞こえてしまうんだ そんな時はどうしたらいい? 良かった事だけ思い出して やけに年老いた気持ちになる とはいえ暮らしの中で 今 動き出そうとしている 歯車のひとつにならなくてはなぁ 希望の数だけ失望は増える それでも明日に胸は震える 「どんな事が起こるんだろう?」 想像してみるんだよ ねぇ くるみ 時間が何もかも洗い連れ去ってくれれば 生きる事は実に容易い ねぇ くるみ あれからは一度も涙は流してないよ でも 本気で笑う事も少ない どこかで掛け違えてきて 気が付けば一つ余ったボタン 同じようにして誰かが 持て余したボタンホールに 出会う事で意味が出来たならいい 出会いの数だけ別れは増える それでも希望に胸は震える 十字路に出くわすたび 迷いもするだろうけど 今以上をいつも欲しがるくせに 変わらない愛を求め歌う そうして歯車は回る この必要以上の負担に ギシギシ鈍い音をたてながら 希望の数だけ失望は増える それでも明日に胸は震える 「どんな事が起こるんだろう?」 想像してみよう 出会いの数だけ別れは増える それでも希望に胸は震える 引き返しちゃいけないよね 進もう 君のいない道の上へ
68,くるみ -for the Film- 幸福な食卓,"
Mr.Children",Kazutoshi Sakurai,Kazutoshi Sakurai,ねぇ くるみ この街の景色は君の目にどう映るの? 今の僕はどう見えるの? ねぇ くるみ 誰かの優しさも皮肉に聞こえてしまうんだ そんな時はどうしたらいい? 良かった事だけ思い出して やけに年老いた気持ちになる とはいえ暮らしの中で 今 動き出そうとしている 歯車のひとつにならなくてはなぁ 希望の数だけ失望は増える それでも明日に胸は震える 「どんな事が起こるんだろう?」 想像してみるんだよ ねぇ くるみ 時間が何もかも洗い連れ去ってくれれば 生きる事は実に容易い ねぇ くるみ あれからは一度も涙は流してないよ でも 本気で笑う事も少ない どこかで掛け違えてきて 気が付けば一つ余ったボタン 同じようにして誰かが 持て余したボタンホールに 出会う事で意味が出来たならいい 出会いの数だけ別れは増える それでも希望に胸は震える 十字路に出くわすたび 迷いもするだろうけど 今以上をいつも欲しがるくせに 変わらない愛を求め歌う そうして歯車は回る この必要以上の負担に ギシギシ鈍い音をたてながら 希望の数だけ失望は増える それでも明日に胸は震える 「どんな事が起こるんだろう?」 想像してみよう 出会いの数だけ別れは増える それでも希望に胸は震える 引き返しちゃいけないよね 進もう 君のいない道の上へ
69,CROSS ROAD,"
Mr.Children",桜井和寿,桜井和寿,lookin' for love 今建ち並ぶ街の中で 口ずさむ 『ticket to ride』 あきれるくらい君へのメロディー 遠い記憶の中にだけ 君の姿探しても もう戻らない でも忘れない 愛しい微笑み 真冬のひまわりのように 鮮やかに揺れてる 過ぎ去った季節に 置き忘れた時間を もう一度つかまえたい 誰もが胸の奥に秘めた 迷いの中で 手にしたぬくもりを それぞれに抱きしめて 新たなる道を行く 誘惑に彩られた 一度だけの誤ちを 今も君は許せぬまま 暮らす毎日 冷たい風に吹かれて たたずむマテリアルワールド 立ち止まる cross road さまよう winding road 傷つけずには愛せない 遠く想い焦がれて はりさけそうな夜も この手に受け止める つかの間の悲しみは やがて輝く未来へと 抱き合う度にいつも 二人歩んだ日々の 答えを探してきたけど 崩れてく音もたてずに 果たせぬままの夢 誰もが胸の奥に秘めた 迷いの中で 手にしたぬくもりを それぞれに抱きしめて 新たなる道を行く 遠く想い焦がれて はりさけそうな夜も この手に受け止める つかの間の悲しみは やがて輝く未来へと
70,グッバイ・マイ・グルーミーデイズ,"
Mr.Children",桜井和寿,桜井和寿・小林武史,"いつの間にか こんなふうに 夜空に溜め息浮かべてる あの娘の笑顔が ふっと 目を閉じるたびに 溢れてる 押さえきれず ダイヤル廻したけど 留守番電話に名前を ただ告げるだけ 待ちわびてるんだ ずっと Night & Day 本当の気持ち 聞けないまま 月とグラス合わせて 一人きりの Happy Birthday あきらめてた 心のポストの中 遅れて届いた あの娘からの Birthday Card 忘れかけてた想いが 胸の中ではじけてる tul… We want to be happy 始まりそうな予感で 体中がしびれてる もう止められない I want to be happy, You want to be happy I want to be happy, You want to be happy こぼれ落ちそうな星空 眠れずにずっと 眺めてた トラブル続きの 6days 忘れられそうなこの Weekend 夕べあの娘からの Telephone Call 真夜中まで 尽きない話の続きが 今日の待ち合わせ 忘れかけてた想いが 胸の中ではじけてる tul… We want to be happy 始まりそうな予感が 体中を駆けめぐる もう 止められない I want to be happy, You want to be happy I want to be happy, You want to be happy Good-bye my gloomy days"
71,幻聴,"
Mr.Children",桜井和寿,桜井和寿,やっと一息つけるねって思ったのも束の間 また僕は走り出す 決してのんびり暮らすのが嫌いなわけじゃない でももう一度走り出す 観覧車に乗っかった時に目にしたのは 地平線のある景色 そこで僕は手に入れたんだ 遮るもののない 果てなく広がる世界 夢から夢へと橋を架けて渡る そんなイメージが駆け巡り 向こうで手招くのは宝島などじゃなく 人懐っこくて 優しくて 暖かな誰かの微笑み 遠くで すぐそばで 僕を呼ぶ声がする そんな幻聴に 耳を澄まし追いかけるよ 切り札を隠し持っているように思わせてるカードは 実際は何の効力もない だけど捨てないで持ってれば 何かの意味を持つ可能性はなくない 一歩 また一歩 確実に進む そんなイメージも忘れずに 僕を手招くのは華やかな場所じゃなく 口下手で 人見知りで ちょっと寂しがり屋の溜息 遠くで すぐそばで 君の呼ぶ声がする そんな幻聴に 耳を澄まし追いかけるよ 向こうで手招くのは宝島などじゃなく 人懐っこくて 優しくて 暖かな誰かの微笑み 遠くで すぐそばで 僕を呼ぶ声がする そんな幻聴に 耳を澄まし また今日も 夢の橋を渡り追いかけるよ
72,声,"
Mr.Children",Kazutoshi Sakurai,Kazutoshi Sakurai,言葉はなかった メロディーすらなかった リズムなんてどうでもよかった 喉まで上がった もやもやがあった 大声で叫びそうになった この街にあふれてる スピーカーから流れてる でも君にぴったりの歌を僕は探している 昔は嫌いだった なんか照れくさかった でも誰かに好かれたかった ファルセット出なかった ハモるの下手だった だけど三度下を歌いたがった 時には悲しんだり 時には喜んだり 君が鳴らす音楽にそっと寄り添っていたい 言葉はなかった メロディーすらなかった リズムなんてどうでもよかった 胸にしまってあった もやもやがあった たまらなく君に逢いたかった 別に巧くなくていい 声が枯れてたっていい 受け止めてくれる誰かがその声を待っている
73,こんな風にひどく蒸し暑い日,"
Mr.Children",KAZUTOSHI SAKURAI,KAZUTOSHI SAKURAI,エビバデ・クラップ・ユアー・ハンズ きっと素敵な事も沢山あるでしょう でもこんな風にひどく蒸し暑い日は 思い出してしまうんだ その日 記録的猛暑が僕らを襲ってきて 映画館に逃げ込んで卑猥な映画見た 部屋に着くともう僕らはガラス窓閉め切って エアコンのない君の部屋で ただ夢中になってた 流れ出したモノでシーツが濡れてしまって 君はゴミでも捨てるように洗濯機に入れた 忘れて過ごしてんだ そんな光景は 今じゃ女房も子もある でもこんな風にひどく蒸し暑い日は 思い出してしまうんだ キャスターは温暖化の深刻さ訴える 「異常ですね」っておばちゃんも広場で話してる 人類の行く末 考えると不安で 水浸しの地球儀が夢の中でプカプカ浮いてた 忘れたふりしてんだ あんな光景は そんなに怖がってもいらんない でもこんな風にひどく蒸し暑い日は 思い出してしまうんだ エビバデ・クラップ・ユアー・ハンズ きっと素敵な事も沢山あるでしょう でもこんな風にひどく蒸し暑い日は 思い出してしまうんだ エビバデ・クラップ・ユアー・ハンズ 有楽町で今夜ホステスさんと遊ぶよ でもこんな風にひどく蒸し暑い日は 思い出してしまうんだ 思い出したくないが 思い出してしまうんだ
